{
  "analyzers": [
    {
      "analyzerId": "en-ud-gumreddit-feature-profile",
      "coverage": {
        "featureValueCount": 55,
        "tokenCount": 16364
      },
      "resourceIds": [
        "en-ud-gumreddit-features",
        "en-ud-gumreddit-annotations"
      ],
      "type": "statistical"
    }
  ],
  "featureInventory": [
    {
      "count": 1,
      "feature": "Abbr",
      "values": [
        "Yes"
      ]
    },
    {
      "count": 3,
      "feature": "Case",
      "values": [
        "Acc",
        "Gen",
        "Nom"
      ]
    },
    {
      "count": 2,
      "feature": "Definite",
      "values": [
        "Def",
        "Ind"
      ]
    },
    {
      "count": 3,
      "feature": "Degree",
      "values": [
        "Cmp",
        "Pos",
        "Sup"
      ]
    },
    {
      "count": 4,
      "feature": "ExtPos",
      "values": [
        "ADP",
        "ADV",
        "CCONJ",
        "SCONJ"
      ]
    },
    {
      "count": 3,
      "feature": "Gender",
      "values": [
        "Fem",
        "Masc",
        "Neut"
      ]
    },
    {
      "count": 3,
      "feature": "Mood",
      "values": [
        "Imp",
        "Ind",
        "Sub"
      ]
    },
    {
      "count": 3,
      "feature": "Number",
      "values": [
        "Plur",
        "Ptan",
        "Sing"
      ]
    },
    {
      "count": 3,
      "feature": "NumForm",
      "values": [
        "Combi",
        "Digit",
        "Word"
      ]
    },
    {
      "count": 4,
      "feature": "NumType",
      "values": [
        "Card",
        "Frac",
        "Mult",
        "Ord"
      ]
    },
    {
      "count": 3,
      "feature": "Person",
      "values": [
        "1",
        "2",
        "3"
      ]
    },
    {
      "count": 2,
      "feature": "Polarity",
      "values": [
        "Neg",
        "Pos"
      ]
    },
    {
      "count": 1,
      "feature": "Poss",
      "values": [
        "Yes"
      ]
    },
    {
      "count": 9,
      "feature": "PronType",
      "values": [
        "Art",
        "Dem",
        "Emp",
        "Ind",
        "Int",
        "Neg",
        "Prs",
        "Rel",
        "Tot"
      ]
    },
    {
      "count": 1,
      "feature": "Reflex",
      "values": [
        "Yes"
      ]
    },
    {
      "count": 2,
      "feature": "Style",
      "values": [
        "Coll",
        "Vrnc"
      ]
    },
    {
      "count": 2,
      "feature": "Tense",
      "values": [
        "Past",
        "Pres"
      ]
    },
    {
      "count": 1,
      "feature": "Typo",
      "values": [
        "Yes"
      ]
    },
    {
      "count": 4,
      "feature": "VerbForm",
      "values": [
        "Fin",
        "Ger",
        "Inf",
        "Part"
      ]
    },
    {
      "count": 1,
      "feature": "Voice",
      "values": [
        "Pass"
      ]
    }
  ],
  "kind": "morphology",
  "languageTag": "en",
  "morphologyId": "en-ud-gumreddit-morphosyntax",
  "resourceRefs": [
    {
      "recordCount": 55,
      "resourceId": "en-ud-gumreddit-features",
      "role": "feature-inventory"
    },
    {
      "recordCount": 16364,
      "resourceId": "en-ud-gumreddit-annotations",
      "role": "analyzer"
    }
  ],
  "schemaVersion": "1",
  "script": "Latn"
}
